{"count":1,"next":null,"previous":null,"results":[{"id":8306,"game_id":17988,"game_slug":"magic-the-gathering-arena","name":"Magic: The Gathering - Arena","year":2017,"user":"alexsim92","runner":"wine","slug":"magic-the-gathering-arena-latest","version":"Latest","description":null,"notes":"Known issues: <a href=\"https://forums.mtgarena.com/forums/threads/37048\">https://forums.mtgarena.com/forums/threads/37048</a>\r\n\r\nMTGA Pro Tracker does not work.","created_at":"2018-05-16T21:55:30.514000Z","updated_at":"2019-09-23T00:53:24.137236Z","draft":false,"published":true,"published_by":51687,"rating":"4","steamid":null,"gogid":null,"gogslug":"","humblestoreid":"","script":{"wine":{"Desktop":true,"esync":true,"version":"tkg-unity-4.5-x86_64"},"installer":[{"task":{"description":"Creating Wine prefix","prefix":"$GAMEDIR","name":"create_prefix"}},{"task":{"path":"HKEY_CURRENT_USER\\Software\\Wine\\X11 Driver","prefix":"$GAMEDIR","name":"set_regedit","key":"GrabFullscreen","value":"Y"}},{"task":{"path":"HKEY_CURRENT_USER\\Software\\Wine\\X11 Driver","prefix":"$GAMEDIR","name":"set_regedit","key":"UseTakeFocus","value":"N"}},{"task":{"description":"Installing .NET 4.7.2. This will take a while...","prefix":"$GAMEDIR","name":"winetricks","app":"dotnet472"}},{"task":{"prefix":"$GAMEDIR","name":"winetricks","app":"faudio arial win10"}},{"task":{"prefix":"$GAMEDIR","name":"winekill"}},{"copy":{"src":"setup","dst":"$CACHE/mtg-arena/"}},{"task":{"prefix":"$GAMEDIR","description":"Installing Magic the Gathering Arena","exclude_processes":"mscorsvw.exe rundll32.exe MTGA.exe UnityCrashHandler32.exe","executable":"msiexec","name":"wineexec","args":"/i \"$CACHE/mtg-arena/MTGAInstaller_0.1.1699.730588.msi\" /q"}},{"task":{"prefix":"$GAMEDIR","name":"winekill"}}],"system":{"env":{"PULSE_LATENCY_MSEC":60}},"files":[{"setup":"https://mtgarena.downloads.wizards.com/Live/Windows32/versions/1699.730588/MTGAInstaller_0.1.1699.730588.msi"}],"game":{"exe":"drive_c/Program Files (x86)/Wizards of the Coast/MTGA/MTGA.exe","prefix":"$GAMEDIR"}},"content":"files:\n- setup: https://mtgarena.downloads.wizards.com/Live/Windows32/versions/1699.730588/MTGAInstaller_0.1.1699.730588.msi\ngame:\n  exe: drive_c/Program Files (x86)/Wizards of the Coast/MTGA/MTGA.exe\n  prefix: $GAMEDIR\ninstaller:\n- task:\n    description: Creating Wine prefix\n    name: create_prefix\n    prefix: $GAMEDIR\n- task:\n    key: GrabFullscreen\n    name: set_regedit\n    path: HKEY_CURRENT_USER\\Software\\Wine\\X11 Driver\n    prefix: $GAMEDIR\n    value: Y\n- task:\n    key: UseTakeFocus\n    name: set_regedit\n    path: HKEY_CURRENT_USER\\Software\\Wine\\X11 Driver\n    prefix: $GAMEDIR\n    value: N\n- task:\n    app: dotnet472\n    description: Installing .NET 4.7.2. This will take a while...\n    name: winetricks\n    prefix: $GAMEDIR\n- task:\n    app: faudio arial win10\n    name: winetricks\n    prefix: $GAMEDIR\n- task:\n    name: winekill\n    prefix: $GAMEDIR\n- copy:\n    dst: $CACHE/mtg-arena/\n    src: setup\n- task:\n    args: /i \"$CACHE/mtg-arena/MTGAInstaller_0.1.1699.730588.msi\" /q\n    description: Installing Magic the Gathering Arena\n    exclude_processes: mscorsvw.exe rundll32.exe MTGA.exe UnityCrashHandler32.exe\n    executable: msiexec\n    name: wineexec\n    prefix: $GAMEDIR\n- task:\n    name: winekill\n    prefix: $GAMEDIR\nsystem:\n  env:\n    PULSE_LATENCY_MSEC: 60\nwine:\n  Desktop: true\n  esync: true\n  version: tkg-unity-4.5-x86_64\n"}]}